title,source_url,r2_key,verdict,evidence
Wealth Inequality in the United States since 1913: Evidence from Capitalized Income Tax Data,https://eml.berkeley.edu/~saez/SaezZucman2016QJE.pdf,sources/e6/e68824db6f9dbced0f156ab9931cd9beeaac819f5a11aa6c018f584a1a5782de.pdf,HOLD,all rights reserved
"Welfare Effects of a Permanent Unconditional Cash Transfer Program: Evidence from Marica, Brazil",https://doi.org/10.3386/w33089,sources/82/8202950cd2ad2cd52861d6e817236384e176d18f43e6419756497d6a1c056328.pdf,HOLD,all rights reserved
Welfare Effects of Property Taxation,https://docs.iza.org/dp14195.pdf,sources/fb/fb0a03892bb7fe88e23a6e1a95cab8fc0a4a3a89c35e8fad851c37473d3b7f72.pdf,HOLD,no clear license statement
"Welfare Effects of Property Taxation (ECONtribute DP 331, 2024 revision)",https://www.econtribute.de/RePEc/ajk/ajkdps/ECONtribute_331_2024.pdf,sources/08/08b01c2fe096f82dd4bc0e98d728e2d161219f536900f94482293b433f006a94.pdf,HOLD,no clear license statement
What's Manhattan Worth? A Land Values Index from 1950 to 2014,https://sasn.rutgers.edu/sites/default/files/2024-02/Whats%20Mahattan%20Worth%20v3.1%20Oct%202015.pdf,sources/b4/b47a0d3739ff75af992c8a9ef1a51edc72c4b95b7ceca0f01d5ccb3188c02718.pdf,HOLD,no clear license statement
Who Benefits From Productivity Growth? Direct and Indirect Effects of Local TFP Growth on Wages Rents and Inequality,https://www.nber.org/system/files/working_papers/w24661/w24661.pdf,sources/33/339f33c5b243091301cbaa6efb8d7c1770275168889c097181b0d4207b772092.pdf,HOLD,all rights reserved
Why Rent Matters: The Hidden and Suppressed Economic Rent,https://cooperative-individualism.org/foldvary-fred_why-rent-matters-the-hidden-and-suppressed-economic-rent-2012-jun.pdf,sources/54/54bc09ccc7f1843d672394d4bfb2a0cc637e6c72a23505beed4153680a715e5d.pdf,HOLD,no clear license statement
"Why So Little Georgism in America: Using the Pennsylvania Case Files to Understand the Slow, Uneven Progress of Land Val",https://www.lincolninst.edu/app/uploads/legacy-files/pubfiles/1275_hughes_final.pdf,sources/86/86ec8913e90008388e36e6d97083286d9ee24f4a7f98d1b240ec3e1ef18d7fa9.pdf,HOLD,no clear license statement
Why We Need a Green Land Value Tax and How to Design It,https://www.inet.ox.ac.uk/files/J-Muellbauer-Why-we-need-a-green-land-value-tax-and-how-to-design-it-INET-Oxford-working-paper-2023-11.pdf,sources/32/32670d3baa20b0bf5bc9e2a279895bd69e8f7623f79a1426a48847a705aadd0c.pdf,HOLD,no clear license statement
Working Towards Economic Reconciliation: Government Resource Revenue Sharing in BC Ontario and the Yukon,https://www.willmsshier.com/docs/default-source/articles/article---working-towards-economic-reconciliation-part-1-government-resource-revenue-sharing-in-british-columbia-ontario-and-the-yukon---ja-cm-lw---july-17-2018.pdf,sources/69/690e56d883e03dc2963ed023d39722262a907fb9017e842699ad70de8d9f95a8.pdf,HOLD,no clear license statement
Your Citizen's Dividend (eBook),https://citdiv.org/wp-content/uploads/2026/05/Your-Citizens-dividend-E-Book.pdf,sources/79/79c11e2c64a9ce7097bbb916da81df073142bc8b67d0ff06fa818015f62aee72.pdf,HOLD,no clear license statement
Your House Just Doubled in Value? Don't Uncork the Champagne Just Yet!,https://www.philadelphiafed.org/-/media/frbp/assets/economy/articles/business-review/2006/q1/q1_06_housevalue.pdf,sources/0d/0db783efde46711d235128725264e23493cd581da8b9740e10dfa07dcc289bd0.pdf,HOLD,no clear license statement
